{
  "remediation_id": "REM-010-001",
  "target_claim_ids": [
    "CLM-010-001"
  ],
  "original_verdict": "NOT_EXPLOITABLE",
  "proposed_change": "No remediation asserted.",
  "original_path_ids": [
    "P-010-001"
  ],
  "revalidated_path_ids": [],
  "alternate_path_ids": [],
  "verification_status": "NOT_ASSESSED",
  "evidence_ids": [
    "EVD-010-001"
  ],
  "final_verdict": "NOT_EXPLOITABLE",
  "benchmark_version": "0.1.0",
  "schema_version": "0.1"
}
