{
  "remediation_id": "REM-020-001",
  "target_claim_ids": [
    "CLM-020-001"
  ],
  "original_verdict": "EXPLOITABLE",
  "proposed_change": "Protect the obvious endpoint and then verify all alternate paths.",
  "original_path_ids": [
    "P-020-001"
  ],
  "revalidated_path_ids": [],
  "alternate_path_ids": [
    "P-020-001"
  ],
  "verification_status": "FAILED",
  "evidence_ids": [
    "EVD-020-001"
  ],
  "final_verdict": "REMEDIATION_FAILED",
  "benchmark_version": "0.1.0",
  "schema_version": "0.1"
}
