{
  "remediation_id": "REM-005-001",
  "target_claim_ids": [
    "CLM-005-001"
  ],
  "original_verdict": "EXPLOITABLE",
  "proposed_change": "No remediation is asserted for this case.",
  "original_path_ids": [
    "P-005-001"
  ],
  "revalidated_path_ids": [],
  "alternate_path_ids": [],
  "verification_status": "NOT_ASSESSED",
  "evidence_ids": [
    "EVD-005-001"
  ],
  "final_verdict": "EXPLOITABLE",
  "benchmark_version": "0.1.0",
  "schema_version": "0.1"
}
