{
  "remediation_id": "REM-001",
  "benchmark_version": "0.1.0",
  "schema_version": "0.1",
  "target_claim_ids": [
    "CLM-001"
  ],
  "original_verdict": "EXPLOITABLE",
  "proposed_change": "Restrict the endpoint and revalidate the path.",
  "original_path_ids": [
    "P-1"
  ],
  "revalidated_path_ids": [
    "P-1"
  ],
  "alternate_path_ids": [],
  "verification_status": "VERIFIED",
  "evidence_ids": [
    "EVD-001"
  ],
  "final_verdict": "REMEDIATED"
}